[
  {
    "place_key": "myos_hormos",
    "display_name": "Myos Hormos",
    "greek_names": [
      "Μυὸς ὅρμος"
    ],
    "aliases": [
      "Aphrodites Hormos",
      "Quseir el-Qadim"
    ],
    "place_type": "port",
    "lat": 26.156611,
    "lon": 34.24401,
    "certainty": "medium",
    "pleiades_id": "786069",
    "pleiades_uri": "https://pleiades.stoa.org/places/786069",
    "coordinates_source": "Pleiades reprPoint (cached snapshot 786069)",
    "notes": "Opening harbor in section 1. Use as a primary tour stop."
  },
  {
    "place_key": "berenike",
    "display_name": "Berenike",
    "greek_names": [
      "Βερενίκη"
    ],
    "aliases": [
      "Berenice",
      "Berenice Troglodytica",
      "Bender el-Kebir"
    ],
    "place_type": "port",
    "lat": 23.91062525,
    "lon": 35.474818850000005,
    "certainty": "high",
    "pleiades_id": "785986",
    "pleiades_uri": "https://pleiades.stoa.org/places/785986",
    "coordinates_source": "Pleiades reprPoint (cached snapshot 785986)",
    "notes": "Second harbor in section 1 and route anchor for section 2."
  },
  {
    "place_key": "barbarian_country",
    "display_name": "Barbarian country beyond Berenike",
    "greek_names": [],
    "aliases": [
      "Barbarian country"
    ],
    "place_type": "region",
    "lat": null,
    "lon": null,
    "certainty": "low",
    "pleiades_id": null,
    "pleiades_uri": null,
    "coordinates_source": "Not mapped in this starter authority file.",
    "notes": "Narrative coastal region in section 2; model as a descriptive region rather than a fixed point."
  },
  {
    "place_key": "fish_eaters_red_sea",
    "display_name": "Fish-Eaters territory",
    "greek_names": [],
    "aliases": [
      "Ichthyophagoi",
      "Fish-Eaters"
    ],
    "place_type": "ethnographic_region",
    "lat": null,
    "lon": null,
    "certainty": "low",
    "pleiades_id": "40028",
    "pleiades_uri": "https://pleiades.stoa.org/places/40028",
    "coordinates_source": "Identifier noted from Pleiades-linked bibliography; coordinates not set in this scaffold.",
    "notes": "Use as a label/filter, not as a point, unless a project-specific polygon is drawn."
  },
  {
    "place_key": "moschophagoi_territory",
    "display_name": "Moschophagoi territory",
    "greek_names": [
      "Μοσχοφάγοι"
    ],
    "aliases": [
      "Calf-Eaters"
    ],
    "place_type": "ethnographic_region",
    "lat": null,
    "lon": null,
    "certainty": "low",
    "pleiades_id": null,
    "pleiades_uri": null,
    "coordinates_source": "Unresolved in starter authority file.",
    "notes": "Preceding route marker before Ptolemais in section 3."
  },
  {
    "place_key": "ptolemais_theron",
    "display_name": "Ptolemais of the Hunts",
    "greek_names": [
      "Πτολεμαῒς ἡ τῶν θηρῶν"
    ],
    "aliases": [
      "Ptolemais Theron",
      "Ptolemais of the Hunts",
      "Trinkatat"
    ],
    "place_type": "emporion",
    "lat": 18.582600399999997,
    "lon": 37.8854432,
    "certainty": "low",
    "pleiades_id": "39409",
    "pleiades_uri": "https://pleiades.stoa.org/places/39409",
    "coordinates_source": "Pleiades reprPoint (cached snapshot 39409)",
    "notes": "Small trading station. Keep the map marker visually uncertain."
  },
  {
    "place_key": "adulis",
    "display_name": "Adulis",
    "greek_names": [
      "Ἀδουλίς",
      "Ἀδουλὶ"
    ],
    "aliases": [
      "Adouli",
      "Azouli",
      "Zula"
    ],
    "place_type": "port",
    "lat": 15.2616612,
    "lon": 39.6591296,
    "certainty": "high",
    "pleiades_id": "39271",
    "pleiades_uri": "https://pleiades.stoa.org/places/39271",
    "coordinates_source": "Pleiades reprPoint (cached snapshot 39271)",
    "notes": "Lawful emporion and hub for inland ivory and island tortoise-shell supply."
  },
  {
    "place_key": "oreine_island",
    "display_name": "Oreine island",
    "greek_names": [
      "Ὀρεινή"
    ],
    "aliases": [
      "Oreine"
    ],
    "place_type": "island",
    "lat": null,
    "lon": null,
    "certainty": "low",
    "pleiades_id": null,
    "pleiades_uri": null,
    "coordinates_source": "Unresolved in starter authority file.",
    "notes": "Island anchorage outside the bay of Adulis in section 4."
  },
  {
    "place_key": "diodoros_island",
    "display_name": "Diodoros island",
    "greek_names": [
      "Διοδώρου νῆσος"
    ],
    "aliases": [
      "Diodoros"
    ],
    "place_type": "island",
    "lat": null,
    "lon": null,
    "certainty": "low",
    "pleiades_id": null,
    "pleiades_uri": null,
    "coordinates_source": "Unresolved in starter authority file.",
    "notes": "Former anchorage deeper in the bay of Adulis."
  },
  {
    "place_key": "koloe",
    "display_name": "Koloe",
    "greek_names": [
      "Κολόη"
    ],
    "aliases": [
      "Koloe",
      "Matara candidate",
      "Qohaito candidate"
    ],
    "place_type": "inland_market",
    "lat": 14.709112,
    "lon": 39.552787,
    "certainty": "low",
    "pleiades_id": "39363",
    "pleiades_uri": "https://pleiades.stoa.org/places/39363",
    "coordinates_source": "Pleiades reprPoint (cached snapshot 39363)",
    "notes": "First ivory market inland from Adulis. Treat as a candidate location."
  },
  {
    "place_key": "matara_candidate_for_koloe",
    "display_name": "Matara, possible Koloe candidate",
    "greek_names": [],
    "aliases": [
      "Matara",
      "Metera"
    ],
    "place_type": "archaeological_site",
    "lat": 14.675334943988744,
    "lon": 39.42565916570811,
    "certainty": "medium",
    "pleiades_id": "403627899",
    "pleiades_uri": "https://pleiades.stoa.org/places/403627899",
    "coordinates_source": "Pleiades reprPoint (cached snapshot 403627899)",
    "notes": "Included as an optional candidate layer for Koloe, not used in the default route line."
  },
  {
    "place_key": "aksum_metropolis",
    "display_name": "Aksumite metropolis",
    "greek_names": [
      "Αὐξωμίτης"
    ],
    "aliases": [
      "Aksum",
      "A(u)xoume",
      "Axoume"
    ],
    "place_type": "metropolis",
    "lat": 14.133850459089953,
    "lon": 38.721292020401236,
    "certainty": "high",
    "pleiades_id": "39303",
    "pleiades_uri": "https://pleiades.stoa.org/places/39303",
    "coordinates_source": "Pleiades reprPoint (cached snapshot 39303)",
    "notes": "Inland metropolis in the ivory chain of section 4."
  },
  {
    "place_key": "kyeneion",
    "display_name": "Kyeneion",
    "greek_names": [
      "Κυήνειον"
    ],
    "aliases": [
      "Kyeneion"
    ],
    "place_type": "route_marker",
    "lat": null,
    "lon": null,
    "certainty": "low",
    "pleiades_id": null,
    "pleiades_uri": null,
    "coordinates_source": "Unresolved in starter authority file.",
    "notes": "Named transit point for ivory from beyond the Nile."
  },
  {
    "place_key": "beyond_the_nile",
    "display_name": "Beyond the Nile",
    "greek_names": [
      "πέραν τοῦ Νείλου"
    ],
    "aliases": [
      "Beyond the Nile"
    ],
    "place_type": "source_region",
    "lat": null,
    "lon": null,
    "certainty": "low",
    "pleiades_id": null,
    "pleiades_uri": null,
    "coordinates_source": "Not a point; model as a region/source label.",
    "notes": "Ultimate source region in the ivory movement."
  },
  {
    "place_key": "alalaiou_islands",
    "display_name": "Alalaiou islands",
    "greek_names": [
      "Ἀλαλαίου"
    ],
    "aliases": [
      "Dahlak Archipelago",
      "Aliaeu"
    ],
    "place_type": "archipelago",
    "lat": 15.728925745506515,
    "lon": 40.00315050622464,
    "certainty": "high",
    "pleiades_id": "39281",
    "pleiades_uri": "https://pleiades.stoa.org/places/39281",
    "coordinates_source": "Pleiades reprPoint (cached snapshot 39281)",
    "notes": "Offshore islands supplying tortoise shell to Adulis."
  },
  {
    "place_key": "meroe",
    "display_name": "Meroe",
    "greek_names": [
      "Μερόη"
    ],
    "aliases": [
      "Meroë",
      "Begrawiya"
    ],
    "place_type": "metropolis",
    "lat": 16.936857973308044,
    "lon": 33.71192022614201,
    "certainty": "high",
    "pleiades_id": "805630",
    "pleiades_uri": "https://pleiades.stoa.org/places/805630",
    "coordinates_source": "Pleiades reprPoint (cached snapshot 805630)",
    "notes": "Inland metropolis noted westward behind coastal peoples in section 2."
  }
]
